_id,category,url,name,path
9e2e4b5acc80661e770632771be321e078334ac2,Archival,https://images.unsplash.com/photo-1681057574319-071be1179877?q=80&w=1000&auto=format&fit=crop&ixlib=rb-4.0.3&ixid=M3wxMjA3fDB8MHx0b3BpYy1mZWVkfDEzfEUtLV9wbklpckc0fHxlbnwwfHx8fHw%3D,a painting of red and white shapes on a yellow background,C:\Users\uc201\Desktop\GB\HW\Data-Collection-and-Markup\seminar_6\images\a painting of red and white shapes on a yellow background-9e2e4b5acc80661e770632771be321e078334ac2.jpg
42363e52735093aab0c1dde26c360ebe2f98aa16,Archival,https://images.unsplash.com/photo-1709888246722-aeb4be51c2b0?q=80&w=1000&auto=format&fit=crop&ixlib=rb-4.0.3&ixid=M3wxMjA3fDB8MHx0b3BpYy1mZWVkfDE0fEUtLV9wbklpckc0fHxlbnwwfHx8fHw%3D,a painting of a woman holding a child,C:\Users\uc201\Desktop\GB\HW\Data-Collection-and-Markup\seminar_6\images\a painting of a woman holding a child-42363e52735093aab0c1dde26c360ebe2f98aa16.jpg
b631535e475e67c2a78c95abdb9e03a4e7155810,Archival,https://images.unsplash.com/photo-1681057575594-4c14762a6520?q=80&w=1000&auto=format&fit=crop&ixlib=rb-4.0.3&ixid=M3wxMjA3fDB8MHx0b3BpYy1mZWVkfDE1fEUtLV9wbklpckc0fHxlbnwwfHx8fHw%3D,a painting of a vase of flowers on a table,C:\Users\uc201\Desktop\GB\HW\Data-Collection-and-Markup\seminar_6\images\a painting of a vase of flowers on a table-b631535e475e67c2a78c95abdb9e03a4e7155810.jpg
85ab9cd16ce81db740322129882d281bf86e5cbb,Archival,https://images.unsplash.com/photo-1710066388604-c335a0e6be58?q=80&w=1000&auto=format&fit=crop&ixlib=rb-4.0.3&ixid=M3wxMjA3fDB8MHx0b3BpYy1mZWVkfDE2fEUtLV9wbklpckc0fHxlbnwwfHx8fHw%3D,a painting of a woman in a green dress,C:\Users\uc201\Desktop\GB\HW\Data-Collection-and-Markup\seminar_6\images\a painting of a woman in a green dress-85ab9cd16ce81db740322129882d281bf86e5cbb.jpg
2f0049f23e63bc5e75bbb0c828eaeac93103ed9e,Film,https://images.unsplash.com/photo-1711635745533-23de5f97cbd5?q=80&w=1000&auto=format&fit=crop&ixlib=rb-4.0.3&ixid=M3wxMjA3fDB8MHx0b3BpYy1mZWVkfDF8aG1lbnZRaFVteE18fGVufDB8fHx8fA%3D%3D,a man flying through the air while riding a skateboard,C:\Users\uc201\Desktop\GB\HW\Data-Collection-and-Markup\seminar_6\images\a man flying through the air while riding a skateboard-2f0049f23e63bc5e75bbb0c828eaeac93103ed9e.jpg
fb773b32e361158b3a4acf06006a30b5833d2407,Archival,https://images.unsplash.com/photo-1580192985064-8162417ce8b0?q=80&w=1000&auto=format&fit=crop&ixlib=rb-4.0.3&ixid=M3wxMjA3fDB8MHx0b3BpYy1mZWVkfDE3fEUtLV9wbklpckc0fHxlbnwwfHx8fHw%3D,white bird on brown wooden table,C:\Users\uc201\Desktop\GB\HW\Data-Collection-and-Markup\seminar_6\images\white bird on brown wooden table-fb773b32e361158b3a4acf06006a30b5833d2407.jpg
9cd8bf7edfaee4455eafb956e56f38158be92e63,Archival,https://images.unsplash.com/photo-1587659501025-08734eaf1895?q=80&w=1000&auto=format&fit=crop&ixlib=rb-4.0.3&ixid=M3wxMjA3fDB8MHx0b3BpYy1mZWVkfDE4fEUtLV9wbklpckc0fHxlbnwwfHx8fHw%3D,text,C:\Users\uc201\Desktop\GB\HW\Data-Collection-and-Markup\seminar_6\images\text-9cd8bf7edfaee4455eafb956e56f38158be92e63.jpg
0fdd699743797910dfd2513ab964e51e7d1dae8d,Film,https://images.unsplash.com/photo-1711995619669-c14c2d605ca1?q=80&w=1000&auto=format&fit=crop&ixlib=rb-4.0.3&ixid=M3wxMjA3fDB8MHx0b3BpYy1mZWVkfDJ8aG1lbnZRaFVteE18fGVufDB8fHx8fA%3D%3D,a man standing in a doorway of a white building,C:\Users\uc201\Desktop\GB\HW\Data-Collection-and-Markup\seminar_6\images\a man standing in a doorway of a white building-0fdd699743797910dfd2513ab964e51e7d1dae8d.jpg
de9ac1b44094374dd2abe607a9900957edd6c47d,Film,https://images.unsplash.com/photo-1712082476130-cdc87c863313?q=80&w=1000&auto=format&fit=crop&ixlib=rb-4.0.3&ixid=M3wxMjA3fDB8MHx0b3BpYy1mZWVkfDN8aG1lbnZRaFVteE18fGVufDB8fHx8fA%3D%3D,two trucks driving down a highway next to a forest,C:\Users\uc201\Desktop\GB\HW\Data-Collection-and-Markup\seminar_6\images\two trucks driving down a highway next to a forest-de9ac1b44094374dd2abe607a9900957edd6c47d.jpg
8a8ee30d61e2ac0a0ccd07208e28440652e623b2,Archival,https://images.unsplash.com/photo-1694725411264-57731690bf1a?q=80&w=1000&auto=format&fit=crop&ixlib=rb-4.0.3&ixid=M3wxMjA3fDB8MHx0b3BpYy1mZWVkfDE5fEUtLV9wbklpckc0fHxlbnwwfHx8fHw%3D,a painting of a woman with long hair,C:\Users\uc201\Desktop\GB\HW\Data-Collection-and-Markup\seminar_6\images\a painting of a woman with long hair-8a8ee30d61e2ac0a0ccd07208e28440652e623b2.jpg
589f061f4654804ea183fc16cd357bc41fb45742,Archival,https://images.unsplash.com/photo-1711699487364-7975fee8526c?q=80&w=1000&auto=format&fit=crop&ixlib=rb-4.0.3&ixid=M3wxMjA3fDB8MHx0b3BpYy1mZWVkfDIwfEUtLV9wbklpckc0fHxlbnwwfHx8fHw%3D,a man standing in the middle of an ice cave,C:\Users\uc201\Desktop\GB\HW\Data-Collection-and-Markup\seminar_6\images\a man standing in the middle of an ice cave-589f061f4654804ea183fc16cd357bc41fb45742.jpg
cd374d6ea380ba9e2697841bcab19b2acc7209d3,Film,https://images.unsplash.com/photo-1711637754258-d93868ad9eaf?q=80&w=1000&auto=format&fit=crop&ixlib=rb-4.0.3&ixid=M3wxMjA3fDB8MHx0b3BpYy1mZWVkfDR8aG1lbnZRaFVteE18fGVufDB8fHx8fA%3D%3D,a pink flower is blooming on a bush,C:\Users\uc201\Desktop\GB\HW\Data-Collection-and-Markup\seminar_6\images\a pink flower is blooming on a bush-cd374d6ea380ba9e2697841bcab19b2acc7209d3.jpg
b4d6864998c7d7231e277ee28d43961096f90f78,Film,https://images.unsplash.com/photo-1709752934581-df0f846a67d8?q=80&w=1000&auto=format&fit=crop&ixlib=rb-4.0.3&ixid=M3wxMjA3fDB8MHx0b3BpYy1mZWVkfDV8aG1lbnZRaFVteE18fGVufDB8fHx8fA%3D%3D,a dirt path in the middle of a forest,C:\Users\uc201\Desktop\GB\HW\Data-Collection-and-Markup\seminar_6\images\a dirt path in the middle of a forest-b4d6864998c7d7231e277ee28d43961096f90f78.jpg
f4213a6597cfcb5dcb65882b043bf3f6971131c9,Film,https://images.unsplash.com/photo-1712082593340-4592ab570d01?q=80&w=1000&auto=format&fit=crop&ixlib=rb-4.0.3&ixid=M3wxMjA3fDB8MHx0b3BpYy1mZWVkfDZ8aG1lbnZRaFVteE18fGVufDB8fHx8fA%3D%3D,a group of people standing in front of a building,C:\Users\uc201\Desktop\GB\HW\Data-Collection-and-Markup\seminar_6\images\a group of people standing in front of a building-f4213a6597cfcb5dcb65882b043bf3f6971131c9.jpg
14aed35635defd13f7b72bdfd55cfdc9bd010476,Film,https://images.unsplash.com/photo-1712082385642-6cde312987e7?q=80&w=1000&auto=format&fit=crop&ixlib=rb-4.0.3&ixid=M3wxMjA3fDB8MHx0b3BpYy1mZWVkfDd8aG1lbnZRaFVteE18fGVufDB8fHx8fA%3D%3D,a circular object in the middle of a garden,C:\Users\uc201\Desktop\GB\HW\Data-Collection-and-Markup\seminar_6\images\a circular object in the middle of a garden-14aed35635defd13f7b72bdfd55cfdc9bd010476.jpg
81ca7989629e5b02e82939b1545f80423ef63aa6,Film,https://images.unsplash.com/photo-1709750290431-f44b1b44b458?q=80&w=1000&auto=format&fit=crop&ixlib=rb-4.0.3&ixid=M3wxMjA3fDB8MHx0b3BpYy1mZWVkfDh8aG1lbnZRaFVteE18fGVufDB8fHx8fA%3D%3D,a black and white photo of a narrow street,C:\Users\uc201\Desktop\GB\HW\Data-Collection-and-Markup\seminar_6\images\a black and white photo of a narrow street-81ca7989629e5b02e82939b1545f80423ef63aa6.jpg
8f4497b7532448f3fd023024e96095cd5e3759ff,Film,https://images.unsplash.com/photo-1711762094047-8611c8eed577?q=80&w=1000&auto=format&fit=crop&ixlib=rb-4.0.3&ixid=M3wxMjA3fDB8MHx0b3BpYy1mZWVkfDl8aG1lbnZRaFVteE18fGVufDB8fHx8fA%3D%3D,a black and white photo of trees and leaves,C:\Users\uc201\Desktop\GB\HW\Data-Collection-and-Markup\seminar_6\images\a black and white photo of trees and leaves-8f4497b7532448f3fd023024e96095cd5e3759ff.jpg
2c1b44451880dbbc04f7822ac604f4f0d86cda2b,Film,https://images.unsplash.com/photo-1711837238765-033ed63e5007?q=80&w=1000&auto=format&fit=crop&ixlib=rb-4.0.3&ixid=M3wxMjA3fDB8MHx0b3BpYy1mZWVkfDEwfGhtZW52UWhVbXhNfHxlbnwwfHx8fHw%3D,a park bench sitting next to a tree with white flowers,C:\Users\uc201\Desktop\GB\HW\Data-Collection-and-Markup\seminar_6\images\a park bench sitting next to a tree with white flowers-2c1b44451880dbbc04f7822ac604f4f0d86cda2b.jpg
f14d6185bd5fb31b4889a1a28e61c574f9d50492,Film,https://images.unsplash.com/photo-1711826519272-90502ab396dc?q=80&w=1000&auto=format&fit=crop&ixlib=rb-4.0.3&ixid=M3wxMjA3fDB8MHx0b3BpYy1mZWVkfDExfGhtZW52UWhVbXhNfHxlbnwwfHx8fHw%3D,a city street filled with lots of traffic next to tall buildings,C:\Users\uc201\Desktop\GB\HW\Data-Collection-and-Markup\seminar_6\images\a city street filled with lots of traffic next to tall buildings-f14d6185bd5fb31b4889a1a28e61c574f9d50492.jpg
a78c351f73f366440e618cbf55a5eee8df10c7b3,Film,https://images.unsplash.com/photo-1711798809907-5bf4bceeda86?q=80&w=1000&auto=format&fit=crop&ixlib=rb-4.0.3&ixid=M3wxMjA3fDB8MHx0b3BpYy1mZWVkfDEyfGhtZW52UWhVbXhNfHxlbnwwfHx8fHw%3D,a car's side view mirror is shown in black and white,C:\Users\uc201\Desktop\GB\HW\Data-Collection-and-Markup\seminar_6\images\a car's side view mirror is shown in black and white-a78c351f73f366440e618cbf55a5eee8df10c7b3.jpg
aac46b1eef5afd628b582767d933348793197f42,Film,https://images.unsplash.com/photo-1711798809846-3159c535375b?q=80&w=1000&auto=format&fit=crop&ixlib=rb-4.0.3&ixid=M3wxMjA3fDB8MHx0b3BpYy1mZWVkfDEzfGhtZW52UWhVbXhNfHxlbnwwfHx8fHw%3D,a black and white photo of a highway,C:\Users\uc201\Desktop\GB\HW\Data-Collection-and-Markup\seminar_6\images\a black and white photo of a highway-aac46b1eef5afd628b582767d933348793197f42.jpg
2554cad2bd28bd0e3558853ffeaf90d6222e0276,Film,https://images.unsplash.com/photo-1711665093719-ccab5f62ccbf?q=80&w=1000&auto=format&fit=crop&ixlib=rb-4.0.3&ixid=M3wxMjA3fDB8MHx0b3BpYy1mZWVkfDE0fGhtZW52UWhVbXhNfHxlbnwwfHx8fHw%3D,a group of people sitting on a bench in front of a building,C:\Users\uc201\Desktop\GB\HW\Data-Collection-and-Markup\seminar_6\images\a group of people sitting on a bench in front of a building-2554cad2bd28bd0e3558853ffeaf90d6222e0276.jpg
b4f92901be56efe5c682afa2a2054cb82cf30ee8,Film,https://images.unsplash.com/photo-1711665093915-8b71aec2ad91?q=80&w=1000&auto=format&fit=crop&ixlib=rb-4.0.3&ixid=M3wxMjA3fDB8MHx0b3BpYy1mZWVkfDE1fGhtZW52UWhVbXhNfHxlbnwwfHx8fHw%3D,a blue and orange sports car parked on the side of the road,C:\Users\uc201\Desktop\GB\HW\Data-Collection-and-Markup\seminar_6\images\a blue and orange sports car parked on the side of the road-b4f92901be56efe5c682afa2a2054cb82cf30ee8.jpg
a4255e6de7f7da8e7ed583c1183351a53316c182,Street Photography,https://images.unsplash.com/photo-1712112188129-04bdab07016a?q=80&w=1000&auto=format&fit=crop&ixlib=rb-4.0.3&ixid=M3wxMjA3fDB8MHx0b3BpYy1mZWVkfDF8eEh4WVRNSExnT2N8fGVufDB8fHx8fA%3D%3D,a subway station with people waiting for the train,C:\Users\uc201\Desktop\GB\HW\Data-Collection-and-Markup\seminar_6\images\a subway station with people waiting for the train-a4255e6de7f7da8e7ed583c1183351a53316c182.jpg
b4142eafb9b615ec15fcd66e12a776bf620c4980,Film,https://images.unsplash.com/photo-1711658450992-3c17ed5fd72b?q=80&w=1000&auto=format&fit=crop&ixlib=rb-4.0.3&ixid=M3wxMjA3fDB8MHx0b3BpYy1mZWVkfDE2fGhtZW52UWhVbXhNfHxlbnwwfHx8fHw%3D,a car driving down a road next to a lush green forest,C:\Users\uc201\Desktop\GB\HW\Data-Collection-and-Markup\seminar_6\images\a car driving down a road next to a lush green forest-b4142eafb9b615ec15fcd66e12a776bf620c4980.jpg
9254b8fcdf6c125182357f57cf768000a558dbab,Film,https://images.unsplash.com/photo-1711658450838-f5d76a2c095d?q=80&w=1000&auto=format&fit=crop&ixlib=rb-4.0.3&ixid=M3wxMjA3fDB8MHx0b3BpYy1mZWVkfDE3fGhtZW52UWhVbXhNfHxlbnwwfHx8fHw%3D,an open door leading into a lush green garden,C:\Users\uc201\Desktop\GB\HW\Data-Collection-and-Markup\seminar_6\images\an open door leading into a lush green garden-9254b8fcdf6c125182357f57cf768000a558dbab.jpg
7807fd8f7c64d4b08e465bc682e87e23897cfd2d,Street Photography,https://images.unsplash.com/photo-1711666073222-ecec8b31e2ca?q=80&w=1000&auto=format&fit=crop&ixlib=rb-4.0.3&ixid=M3wxMjA3fDB8MHx0b3BpYy1mZWVkfDJ8eEh4WVRNSExnT2N8fGVufDB8fHx8fA%3D%3D,a person riding a bike down a street,C:\Users\uc201\Desktop\GB\HW\Data-Collection-and-Markup\seminar_6\images\a person riding a bike down a street-7807fd8f7c64d4b08e465bc682e87e23897cfd2d.jpg
b17d35984e7b1bad5ff3c21e19c1f93973049e0a,Street Photography,https://images.unsplash.com/photo-1712076288946-b28e40ad29cc?q=80&w=1000&auto=format&fit=crop&ixlib=rb-4.0.3&ixid=M3wxMjA3fDB8MHx0b3BpYy1mZWVkfDN8eEh4WVRNSExnT2N8fGVufDB8fHx8fA%3D%3D,a man walking down a street next to tall buildings,C:\Users\uc201\Desktop\GB\HW\Data-Collection-and-Markup\seminar_6\images\a man walking down a street next to tall buildings-b17d35984e7b1bad5ff3c21e19c1f93973049e0a.jpg
391685e97f283ae9000d6023aff8f9a1b8eea978,Film,https://images.unsplash.com/photo-1711639528445-052a11cfde4b?q=80&w=1000&auto=format&fit=crop&ixlib=rb-4.0.3&ixid=M3wxMjA3fDB8MHx0b3BpYy1mZWVkfDE4fGhtZW52UWhVbXhNfHxlbnwwfHx8fHw%3D,an old car parked on the side of the road,C:\Users\uc201\Desktop\GB\HW\Data-Collection-and-Markup\seminar_6\images\an old car parked on the side of the road-391685e97f283ae9000d6023aff8f9a1b8eea978.jpg
0f0d1ea5b8a1caed345273109dca258456ea2440,Film,https://images.unsplash.com/photo-1711639784898-470cf4eb8e0d?q=80&w=1000&auto=format&fit=crop&ixlib=rb-4.0.3&ixid=M3wxMjA3fDB8MHx0b3BpYy1mZWVkfDE5fGhtZW52UWhVbXhNfHxlbnwwfHx8fHw%3D,a row of beach chairs sitting next to each other,C:\Users\uc201\Desktop\GB\HW\Data-Collection-and-Markup\seminar_6\images\a row of beach chairs sitting next to each other-0f0d1ea5b8a1caed345273109dca258456ea2440.jpg
970b220709d0093e96275107976f7541023eacfa,Street Photography,https://images.unsplash.com/photo-1712075335578-d1555835713d?q=80&w=1000&auto=format&fit=crop&ixlib=rb-4.0.3&ixid=M3wxMjA3fDB8MHx0b3BpYy1mZWVkfDR8eEh4WVRNSExnT2N8fGVufDB8fHx8fA%3D%3D,a person walking down a street at night,C:\Users\uc201\Desktop\GB\HW\Data-Collection-and-Markup\seminar_6\images\a person walking down a street at night-970b220709d0093e96275107976f7541023eacfa.jpg
bfcfb02ed7d181c6f0c788e996a6186fd62c39cd,Street Photography,https://images.unsplash.com/photo-1712106313076-74202fd45168?q=80&w=1000&auto=format&fit=crop&ixlib=rb-4.0.3&ixid=M3wxMjA3fDB8MHx0b3BpYy1mZWVkfDV8eEh4WVRNSExnT2N8fGVufDB8fHx8fA%3D%3D,a food stand on a city street with tall buildings in the background,C:\Users\uc201\Desktop\GB\HW\Data-Collection-and-Markup\seminar_6\images\a food stand on a city street with tall buildings in the background-bfcfb02ed7d181c6f0c788e996a6186fd62c39cd.jpg
2e415c2c5d799d759d9d5bca9f30b5124df0993b,Film,https://images.unsplash.com/photo-1711639784874-4b7afa5fa37c?q=80&w=1000&auto=format&fit=crop&ixlib=rb-4.0.3&ixid=M3wxMjA3fDB8MHx0b3BpYy1mZWVkfDIwfGhtZW52UWhVbXhNfHxlbnwwfHx8fHw%3D,a set of stairs leading up to a building,C:\Users\uc201\Desktop\GB\HW\Data-Collection-and-Markup\seminar_6\images\a set of stairs leading up to a building-2e415c2c5d799d759d9d5bca9f30b5124df0993b.jpg
66d59d84ee607609f8ff7aeb163ae604211a5476,Street Photography,https://images.unsplash.com/photo-1712112187978-ff63481fd933?q=80&w=1000&auto=format&fit=crop&ixlib=rb-4.0.3&ixid=M3wxMjA3fDB8MHx0b3BpYy1mZWVkfDZ8eEh4WVRNSExnT2N8fGVufDB8fHx8fA%3D%3D,a train traveling over a bridge next to tall buildings,C:\Users\uc201\Desktop\GB\HW\Data-Collection-and-Markup\seminar_6\images\a train traveling over a bridge next to tall buildings-66d59d84ee607609f8ff7aeb163ae604211a5476.jpg
9138d296e2cea5119a87c1669a93087db8f170fe,Street Photography,https://images.unsplash.com/photo-1712111841667-a3e8ebeb371a?q=80&w=1000&auto=format&fit=crop&ixlib=rb-4.0.3&ixid=M3wxMjA3fDB8MHx0b3BpYy1mZWVkfDd8eEh4WVRNSExnT2N8fGVufDB8fHx8fA%3D%3D,a subway train speeding past a platform at night,C:\Users\uc201\Desktop\GB\HW\Data-Collection-and-Markup\seminar_6\images\a subway train speeding past a platform at night-9138d296e2cea5119a87c1669a93087db8f170fe.jpg
21708123d1567e2af6487745d3fe4a230f078aaf,Street Photography,https://images.unsplash.com/photo-1712053762954-72a21b0a3c0c?q=80&w=1000&auto=format&fit=crop&ixlib=rb-4.0.3&ixid=M3wxMjA3fDB8MHx0b3BpYy1mZWVkfDh8eEh4WVRNSExnT2N8fGVufDB8fHx8fA%3D%3D,a group of people walking across a street next to a tall building,C:\Users\uc201\Desktop\GB\HW\Data-Collection-and-Markup\seminar_6\images\a group of people walking across a street next to a tall building-21708123d1567e2af6487745d3fe4a230f078aaf.jpg
78521998028c68016074df29658c583dab7488d6,Street Photography,https://images.unsplash.com/photo-1711967151343-9e2f55d6146a?q=80&w=1000&auto=format&fit=crop&ixlib=rb-4.0.3&ixid=M3wxMjA3fDB8MHx0b3BpYy1mZWVkfDl8eEh4WVRNSExnT2N8fGVufDB8fHx8fA%3D%3D,an escalator in a building with a skylight above it,C:\Users\uc201\Desktop\GB\HW\Data-Collection-and-Markup\seminar_6\images\an escalator in a building with a skylight above it-78521998028c68016074df29658c583dab7488d6.jpg
943a82510bbb5db20481fedfc770cc2a3a037365,Street Photography,https://images.unsplash.com/photo-1710510026993-f419fc068892?q=80&w=1000&auto=format&fit=crop&ixlib=rb-4.0.3&ixid=M3wxMjA3fDB8MHx0b3BpYy1mZWVkfDEwfHhIeFlUTUhMZ09jfHxlbnwwfHx8fHw%3D,a building with a door and some signs on it,C:\Users\uc201\Desktop\GB\HW\Data-Collection-and-Markup\seminar_6\images\a building with a door and some signs on it-943a82510bbb5db20481fedfc770cc2a3a037365.jpg
8971a55bc9fcf5d2ee280e69aa7dcef66433c11b,Street Photography,https://images.unsplash.com/photo-1711987893763-3f3536eb8b6d?q=80&w=1000&auto=format&fit=crop&ixlib=rb-4.0.3&ixid=M3wxMjA3fDB8MHx0b3BpYy1mZWVkfDExfHhIeFlUTUhMZ09jfHxlbnwwfHx8fHw%3D,a building with a rainbow sign on top of it,C:\Users\uc201\Desktop\GB\HW\Data-Collection-and-Markup\seminar_6\images\a building with a rainbow sign on top of it-8971a55bc9fcf5d2ee280e69aa7dcef66433c11b.jpg
5bd21457835f9e2920d586410bf12dbbc66b12b5,Textures & Patterns,https://images.unsplash.com/photo-1599418978625-1fc805bc068d?q=80&w=1000&auto=format&fit=crop&ixlib=rb-4.0.3&ixid=M3wxMjA3fDB8MHx0b3BpYy1mZWVkfDF8aVVJc25WdGpCMFl8fGVufDB8fHx8fA%3D%3D,white and black smoke illustration,C:\Users\uc201\Desktop\GB\HW\Data-Collection-and-Markup\seminar_6\images\white and black smoke illustration-5bd21457835f9e2920d586410bf12dbbc66b12b5.jpg
1dbc2ba12468664e3e28686001c1ff530da7a5d2,Street Photography,https://images.unsplash.com/photo-1711987894315-628880778b42?q=80&w=1000&auto=format&fit=crop&ixlib=rb-4.0.3&ixid=M3wxMjA3fDB8MHx0b3BpYy1mZWVkfDEyfHhIeFlUTUhMZ09jfHxlbnwwfHx8fHw%3D,a blue parking sign sitting on the side of a building,C:\Users\uc201\Desktop\GB\HW\Data-Collection-and-Markup\seminar_6\images\a blue parking sign sitting on the side of a building-1dbc2ba12468664e3e28686001c1ff530da7a5d2.jpg
9e14dc66e12c76644208e5d5865a7f9d48d1b5fb,Street Photography,https://images.unsplash.com/photo-1711987893415-0be6d8472460?q=80&w=1000&auto=format&fit=crop&ixlib=rb-4.0.3&ixid=M3wxMjA3fDB8MHx0b3BpYy1mZWVkfDEzfHhIeFlUTUhMZ09jfHxlbnwwfHx8fHw%3D,a large building with a clock on the front of it,C:\Users\uc201\Desktop\GB\HW\Data-Collection-and-Markup\seminar_6\images\a large building with a clock on the front of it-9e14dc66e12c76644208e5d5865a7f9d48d1b5fb.jpg
1d814444d3885922cf477bee702040271fb353fe,Textures & Patterns,https://images.unsplash.com/photo-1533134486753-c833f0ed4866?q=80&w=1000&auto=format&fit=crop&ixlib=rb-4.0.3&ixid=M3wxMjA3fDB8MHx0b3BpYy1mZWVkfDJ8aVVJc25WdGpCMFl8fGVufDB8fHx8fA%3D%3D,grey sand wave,C:\Users\uc201\Desktop\GB\HW\Data-Collection-and-Markup\seminar_6\images\grey sand wave-1d814444d3885922cf477bee702040271fb353fe.jpg
356b9f660208d9ad6a867d7edcd5ce28b6b98019,Textures & Patterns,https://images.unsplash.com/photo-1537024004438-3e57d6218d3a?q=80&w=1000&auto=format&fit=crop&ixlib=rb-4.0.3&ixid=M3wxMjA3fDB8MHx0b3BpYy1mZWVkfDN8aVVJc25WdGpCMFl8fGVufDB8fHx8fA%3D%3D,a silhouette of a person in a dark room,C:\Users\uc201\Desktop\GB\HW\Data-Collection-and-Markup\seminar_6\images\a silhouette of a person in a dark room-356b9f660208d9ad6a867d7edcd5ce28b6b98019.jpg
d2c72fec18a17678f4ac23666b0bb7f2f9333c29,Street Photography,https://images.unsplash.com/photo-1711987892390-411c3d63b7e7?q=80&w=1000&auto=format&fit=crop&ixlib=rb-4.0.3&ixid=M3wxMjA3fDB8MHx0b3BpYy1mZWVkfDE0fHhIeFlUTUhMZ09jfHxlbnwwfHx8fHw%3D,a cobblestone street with a clock tower in the background,C:\Users\uc201\Desktop\GB\HW\Data-Collection-and-Markup\seminar_6\images\a cobblestone street with a clock tower in the background-d2c72fec18a17678f4ac23666b0bb7f2f9333c29.jpg
ec0d84846915fe5f9275520ddf761e5bef72bf7e,Street Photography,https://images.unsplash.com/photo-1711959734370-5a82b321ea3e?q=80&w=1000&auto=format&fit=crop&ixlib=rb-4.0.3&ixid=M3wxMjA3fDB8MHx0b3BpYy1mZWVkfDE1fHhIeFlUTUhMZ09jfHxlbnwwfHx8fHw%3D,a yellow car driving down a street at night,C:\Users\uc201\Desktop\GB\HW\Data-Collection-and-Markup\seminar_6\images\a yellow car driving down a street at night-ec0d84846915fe5f9275520ddf761e5bef72bf7e.jpg
79e2f22dc51fbcda5fa78e5da67d6d5310687507,Textures & Patterns,https://images.unsplash.com/photo-1567983048412-177c435e9e77?q=80&w=1000&auto=format&fit=crop&ixlib=rb-4.0.3&ixid=M3wxMjA3fDB8MHx0b3BpYy1mZWVkfDR8aVVJc25WdGpCMFl8fGVufDB8fHx8fA%3D%3D,grayscale photography of coconut palm tree,C:\Users\uc201\Desktop\GB\HW\Data-Collection-and-Markup\seminar_6\images\grayscale photography of coconut palm tree-79e2f22dc51fbcda5fa78e5da67d6d5310687507.jpg
7d053ba2c72d66f32230f5a8c7e102e1797e6dff,Textures & Patterns,https://images.unsplash.com/photo-1613849173934-e0e9721d79a7?q=80&w=1000&auto=format&fit=crop&ixlib=rb-4.0.3&ixid=M3wxMjA3fDB8MHx0b3BpYy1mZWVkfDV8aVVJc25WdGpCMFl8fGVufDB8fHx8fA%3D%3D,grayscale photo of flower buds,C:\Users\uc201\Desktop\GB\HW\Data-Collection-and-Markup\seminar_6\images\grayscale photo of flower buds-7d053ba2c72d66f32230f5a8c7e102e1797e6dff.jpg
0c97d0efcf16e76c665f30e110811f77d2c8a26e,Street Photography,https://images.unsplash.com/photo-1711713867220-a551deeae462?q=80&w=1000&auto=format&fit=crop&ixlib=rb-4.0.3&ixid=M3wxMjA3fDB8MHx0b3BpYy1mZWVkfDE2fHhIeFlUTUhMZ09jfHxlbnwwfHx8fHw%3D,a city street filled with lots of tall buildings,C:\Users\uc201\Desktop\GB\HW\Data-Collection-and-Markup\seminar_6\images\a city street filled with lots of tall buildings-0c97d0efcf16e76c665f30e110811f77d2c8a26e.jpg
a47fe4e33c5b2e72ad2e6179567d75aabde1dc9a,Street Photography,https://images.unsplash.com/photo-1712032880699-d806b32dc095?q=80&w=1000&auto=format&fit=crop&ixlib=rb-4.0.3&ixid=M3wxMjA3fDB8MHx0b3BpYy1mZWVkfDE3fHhIeFlUTUhMZ09jfHxlbnwwfHx8fHw%3D,a group of people standing on the side of a road,C:\Users\uc201\Desktop\GB\HW\Data-Collection-and-Markup\seminar_6\images\a group of people standing on the side of a road-a47fe4e33c5b2e72ad2e6179567d75aabde1dc9a.jpg
4513f370c38b269fbeb3ea302961c3c3e84be283,Textures & Patterns,https://images.unsplash.com/photo-1521052313888-1181c2f5f406?q=80&w=1000&auto=format&fit=crop&ixlib=rb-4.0.3&ixid=M3wxMjA3fDB8MHx0b3BpYy1mZWVkfDZ8aVVJc25WdGpCMFl8fGVufDB8fHx8fA%3D%3D,shallow focus photography of white flower lot,C:\Users\uc201\Desktop\GB\HW\Data-Collection-and-Markup\seminar_6\images\shallow focus photography of white flower lot-4513f370c38b269fbeb3ea302961c3c3e84be283.jpg
50a344f67a3c21ecbf63bd86aab827f37d33922b,Street Photography,https://images.unsplash.com/photo-1711783059489-8a0da5564785?q=80&w=1000&auto=format&fit=crop&ixlib=rb-4.0.3&ixid=M3wxMjA3fDB8MHx0b3BpYy1mZWVkfDE4fHhIeFlUTUhMZ09jfHxlbnwwfHx8fHw%3D,a woman carrying a basket on top of her head,C:\Users\uc201\Desktop\GB\HW\Data-Collection-and-Markup\seminar_6\images\a woman carrying a basket on top of her head-50a344f67a3c21ecbf63bd86aab827f37d33922b.jpg
e3585db0070dabf48fa6034495b3edfa0c410619,Textures & Patterns,https://images.unsplash.com/photo-1702196711695-b44e9eb64324?q=80&w=1000&auto=format&fit=crop&ixlib=rb-4.0.3&ixid=M3wxMjA3fDB8MHx0b3BpYy1mZWVkfDh8aVVJc25WdGpCMFl8fGVufDB8fHx8fA%3D%3D,a black and white photo of a long line of lights,C:\Users\uc201\Desktop\GB\HW\Data-Collection-and-Markup\seminar_6\images\a black and white photo of a long line of lights-e3585db0070dabf48fa6034495b3edfa0c410619.jpg
357bb38b2b293f390f1ba6977fa48337691d2010,Textures & Patterns,https://images.unsplash.com/photo-1704188646899-4198ab26341c?q=80&w=1000&auto=format&fit=crop&ixlib=rb-4.0.3&ixid=M3wxMjA3fDB8MHx0b3BpYy1mZWVkfDl8aVVJc25WdGpCMFl8fGVufDB8fHx8fA%3D%3D,a black and white photo of a building,C:\Users\uc201\Desktop\GB\HW\Data-Collection-and-Markup\seminar_6\images\a black and white photo of a building-357bb38b2b293f390f1ba6977fa48337691d2010.jpg
2fbaf2e1daaabd65bee248e1a3f7ae993e2c23df,Street Photography,https://images.unsplash.com/photo-1711598545833-d96dc9f51b3c?q=80&w=1000&auto=format&fit=crop&ixlib=rb-4.0.3&ixid=M3wxMjA3fDB8MHx0b3BpYy1mZWVkfDE5fHhIeFlUTUhMZ09jfHxlbnwwfHx8fHw%3D,a couple of people that are standing under a tunnel,C:\Users\uc201\Desktop\GB\HW\Data-Collection-and-Markup\seminar_6\images\a couple of people that are standing under a tunnel-2fbaf2e1daaabd65bee248e1a3f7ae993e2c23df.jpg
5a346dee7e9e2041c115827b68a82e42c611d9aa,Street Photography,https://images.unsplash.com/photo-1711873317218-73f1cb784b2e?q=80&w=1000&auto=format&fit=crop&ixlib=rb-4.0.3&ixid=M3wxMjA3fDB8MHx0b3BpYy1mZWVkfDIwfHhIeFlUTUhMZ09jfHxlbnwwfHx8fHw%3D,a red building with a red roof and windows,C:\Users\uc201\Desktop\GB\HW\Data-Collection-and-Markup\seminar_6\images\a red building with a red roof and windows-5a346dee7e9e2041c115827b68a82e42c611d9aa.jpg
48881b190795bcf7d241109a09d744f0dba4199e,Textures & Patterns,https://images.unsplash.com/photo-1711798809884-1134a8a443fa?q=80&w=1000&auto=format&fit=crop&ixlib=rb-4.0.3&ixid=M3wxMjA3fDB8MHx0b3BpYy1mZWVkfDEwfGlVSXNuVnRqQjBZfHxlbnwwfHx8fHw%3D,a black and white photo of trees with no leaves,C:\Users\uc201\Desktop\GB\HW\Data-Collection-and-Markup\seminar_6\images\a black and white photo of trees with no leaves-48881b190795bcf7d241109a09d744f0dba4199e.jpg
dc743523fc570919eefd324533bb38305b905fc1,Textures & Patterns,https://images.unsplash.com/photo-1711873317817-cd40a60ef558?q=80&w=1000&auto=format&fit=crop&ixlib=rb-4.0.3&ixid=M3wxMjA3fDB8MHx0b3BpYy1mZWVkfDExfGlVSXNuVnRqQjBZfHxlbnwwfHx8fHw%3D,a white room with vertical blinds and a tiled floor,C:\Users\uc201\Desktop\GB\HW\Data-Collection-and-Markup\seminar_6\images\a white room with vertical blinds and a tiled floor-dc743523fc570919eefd324533bb38305b905fc1.jpg
